{
  "dataset_version": "proxy_v1_full",
  "failure_taxonomy": [],
  "failures": [
    "verified_precision",
    "evidence_link_accuracy",
    "unresolved_rate"
  ],
  "gate_pass": false,
  "generated_at": "2026-03-07T00:46:05.588513+00:00",
  "incident_status": {
    "blocking": false,
    "summary": "No incident file provided"
  },
  "metrics": {
    "evidence_link_accuracy": 0.0,
    "false_verified_rate": 0.0,
    "package_completion_rate": 1.0,
    "unresolved_rate": 1.0,
    "verified_precision": 0.0
  },
  "per_concept_verified_precision": {},
  "pipeline_version": "pre_partner_gate",
  "regressions": {
    "blocked": false,
    "evidence_link_accuracy_delta": 0.0,
    "verified_precision_delta": 0.0
  },
  "row_counts": {
    "evidence_rows": 650,
    "packages": 50,
    "total_rows": 650,
    "verified_rows": 0
  }
}
