{
  "dataset_version": "dataset_v1.0",
  "failure_taxonomy": [
    {
      "category": "classification_errors",
      "count": 2
    },
    {
      "category": "extraction_errors",
      "count": 4
    },
    {
      "category": "normalization_errors",
      "count": 1
    },
    {
      "category": "evidence_link_errors",
      "count": 1
    },
    {
      "category": "period_alignment_errors",
      "count": 0
    }
  ],
  "failures": [],
  "gate_pass": true,
  "generated_at": "2026-03-06T16:18:27.396071+00:00",
  "metrics": {
    "evidence_link_accuracy": 1.0,
    "false_verified_rate": 0.0,
    "package_completion_rate": 1.0,
    "unresolved_rate": 0.010256410256410256,
    "verified_precision": 1.0
  },
  "pipeline_version": "local",
  "row_counts": {
    "evidence_rows": 780,
    "packages": 60,
    "total_rows": 780,
    "verified_rows": 752
  }
}
